<?xml version="1.0" encoding="UTF-8"?>
<!DOCTYPE language SYSTEM "language.dtd">

<language tag="de">
    <page id="1" descr="puzzle window menu">
        <t id="1" descr="puzzle window title">JigSPuzzle</t>

        <t id="51">Puzzle konnte nicht gespeichert werden.</t>
        <t id="52">Das Puzzle konnte nicht in die angegebene Datei gespeichert werden.</t>
        <t id="53">Puzzle konnte nicht geladen werden.</t>
        <t id="54">Das Puzzle konnte nicht aus der angegebenen Datei geladen werden.</t>
        <t id="55">Puzzle konnte nicht erstellt werden.</t>
        <t id="56">Aus der angegebenen Datei konnte kein Puzzle erstellt werden.</t>
        <t id="57">Puzzle konnte nicht neu gestarted werden.</t>
        <t id="58">Das Puzzle konnte nicht neu gestarted werden.</t>

        <t id="100">Puzzle</t>
        <t id="110">Neues Puzzle Erstellen</t>
        <t id="111">Alle Bilder</t>
        <t id="112">Bilder (*.bmp)</t>
        <t id="113">Bilder (*.gif)</t>
        <t id="114">Bilder (*.jpg)</t>
        <t id="115">Bilder (*.png)</t>
        <t id="120">Altes Puzzle Laden</t>
        <t id="121">JigsPuzzle Puzzles (*.jig)</t>
        <t id="130">Dieses Puzzle Speichern</t>
        <t id="150">Puzzle Durchmischen</t>
        <t id="160">Puzzle Neu Starten</t>
        <t id="180">JigSPuzzle Beenden</t>

        <t id="300">Einstellungen</t>
        <t id="310">Oberfläche</t>
        <t id="320">Puzzle</t>

        <t id="500">Über</t>
        <t id="510">Über JigSPuzzle</t>
        <t id="520">Auf Neue Version Prüfen</t>
    </page>

    <page id="5" descr="ErrorMessageDialog">
        <t id="10">Es trat folgender Fehler auf:</t>
        <t id="20">Nachricht schließen</t>
    </page>

    <page id="10" descr="settings window">
        <t id="1" descr="settings window title">Einstellungen</t>
        <t id="2">Speichern</t>
        <t id="3">Abbrechen</t>

        <t id="11">Oberfläche</t>
        <t id="12">Puzzle</t>

        <t id="85">Einstellungen wurden nicht gespeichert.</t>
        <t id="86">Die Einstellungen konnten nicht gespeichert werden.</t>
        <t id="87">Einstellungen wurden nicht geladen</t>
        <t id="88">Die Einstellungen konnten nicht geladen werden.</t>

        <t id="100">Sprache</t>
        <t id="101">Die verwendete Sprache für die Oberfläche:</t>

        <t id="120">Hintergrundfarbe</t>
        <t id="121">verwendete Farbe:</t>

        <t id="140">Vorschau</t>
        <t id="141">Zeige Vorschau des fertigen Puzzles an</t>

        <t id="160">Größe des Puzzles</t>
        <t id="161">Es wird er folgende Anteil der Puzzlefläche für die Größe des Puzzles verwendet:\nEin Wert von 75% bedeutet, dass das Puzle auf 75% der Größe der Puzzlefläche skaliert wird.</t>
        <t id="164">Behalte Seitenverhältnisse bei</t>
        <t id="167">Verkleinere Bild automatisch</t>
        <t id="170">Vergrößere Bild automatisch</t>

        <t id="180">Anzahl der Puzzleteile</t>
        <t id="181">Anzahl der Puzzleteile:</t>
        <t id="182">Die Anzahl an Puzzleteilen ist ein ungefährer Wert. Es wird versucht, das Puzzle in die angegebene Anzahl an Teilen zu zerteilen. Ist dies nicht möglich, wird eine Zahl sehr nahe an dieser Zahl gewählt.</t>
        <t id="183">Änderung dieses Wertes wird bei einem neuen Puzzle sichtbar.</t>

        <t id="200">Einrast-Größe</t>
        <t id="201">Der Abstand, den zwei Puzzleteile haben müssen, um einzurasten und somit als 'ineinander gesteckt' zu gelten</t>
        <t id="202">klein</t>
        <t id="203">groß</t>

        <t id="220">Sounds</t>
        <t id="222">Spiele Sounds ab</t>
    </page>

    <page id="11" descr="VersionDialog">
        <t id="1">JigSPuzzle</t>

        <t id="10">Diese Version:</t>
        <t id="11">Neueste verfügbare Version:</t>
        <t id="15">-suche-</t>

        <t id="20">Neue Version herunterladen</t>
        <t id="21">Dies ist bereits die aktuelle Version</t>
    </page>

</language>
